{
  "schema_version": 1,
  "contract": "legacy-historical-corpus-lock-v1",
  "snapshot_id": "20260814T202526AEST-pi5-3dc9b4677",
  "inventory": {
    "path": "manifests/preservation-file-inventory.jsonl",
    "bytes": 744155,
    "sha256": "0482f54a47536a0971d061a13a7549ffe0a22094eb13c6bd961d714354221325"
  },
  "critical_population": {
    "files": 1932,
    "bytes": 25586769110,
    "products": 230852,
    "rates": 1319589,
    "failures": 8077
  },
  "candidate_input_population": {
    "files": 1495,
    "bytes": 21179877992
  },
  "immutable_critical_population": {
    "files": 1756,
    "bytes": 21280983214
  },
  "transient_evidence_population": {
    "files": 176,
    "bytes": 4305785896,
    "sqlite_shm_files": 88,
    "sqlite_shm_bytes": 9797632,
    "sqlite_wal_files": 88,
    "sqlite_wal_bytes": 4295988264,
    "candidate_input": false,
    "reason": "SQLite WAL indexes and logs are transient query-adjacent state, not immutable candidate inputs"
  },
  "retained_dates": 92,
  "gap_entries": 2,
  "minimum_candidates": 95,
  "legacy_ledger_records": 93,
  "additive_ledger_audit": {
    "changed_dates": 57,
    "original_files": 568,
    "original_bytes": 18177646221,
    "addition_files": 688,
    "addition_bytes": 147127281
  },
  "quarantine": {
    "semantic_collision_groups": 763,
    "semantic_collision_rows": 1876,
    "semantic_duplicate_same_value_groups": 95,
    "semantic_duplicate_same_value_rows": 190,
    "semantic_nonunique_rows": 2066,
    "td_no_evidence_terms": 460
  },
  "gaps": [
    {"date": "2026-05-14", "status": "known_gap"},
    {"date": "2026-06-26", "status": "unclassified_gap"}
  ]
}
